id,created_at,text
1342365054612561920,2020-12-25 07:02:23,rt merry christmas amp happy holidays litecoin fam litecoin litecoinfam ltc crypto blockchain bitcoin
1341132433018638336,2020-12-21 21:24:23,rt ep w mike offers to help buy bitcoin buys bitcoin
1341118939531657220,2020-12-21 20:30:46,rt microstrategy has purchased an additional bitcoins for million at an average price of per bitcoin
1339991020453294081,2020-12-18 17:48:49,rt id be a billionaire now if i hadnt sold the bitcoins i mined on my laptop in way too early mostly be
1337140489754034176,2020-12-10 21:01:50,rt american insurance company massmutual has purchased million worth of bitcoin reports
1336005936763179009,2020-12-07 17:53:31,rt going live in minutes with charlie lee and jonny litecoinlitecoin bitcoin cryptocurrency youtube link below ht
1335435863648477192,2020-12-06 04:08:15,rt bitcoin bits gt sats time for a bits reboot imo
1334945343511822336,2020-12-04 19:39:06,rt the best thing to do is simply to hodl bitcoin litecoin monero hodl
1331847828356808705,2020-11-26 06:30:41,rt looking to join in on the bitcoin boom a new report from says could be your best bet mi
1328642755568910337,2020-11-17 10:14:52,rt litecoin jumped to ninemonth highs above early on tuesday moving above bitcoin cash to become the seventhlargest crypt
1328537645882904576,2020-11-17 03:17:12,rt toss a bitcoin to ur witcher
1328427861695287296,2020-11-16 20:00:57,rt one of the largest banks in belarus is launching a bitcoin buying service with more cryptocurrencies to be added soon
1328099013002870784,2020-11-15 22:14:14,rt when anyone mentions bitcoin within earshot of me
1324583081546637312,2020-11-06 05:23:10,rt bitcoin vs us dollar bitcoiners assemble
1323451045964439552,2020-11-03 02:24:52,rt announcing lightning pool a noncustodial marketplace to buy and sell bitcoin liquidity on lightningwith pool users ca
1319709159592321027,2020-10-23 18:35:57,rt holy cowmost bullish commentary for bitcoin that i have read from jp morganeven modest crowding out of gold takes bitc
1314700124099018752,2020-10-09 22:51:50,rt today on money talks the creator of litecoin the bitcoin rubber band is winding up long arm of us law
1314359629778829312,2020-10-09 00:18:50,when you buy bitcoin someone else is selling bitcoin
1314238905860857856,2020-10-08 16:19:07,rt meet while playing light nite amp talking about bitcoin topics next wednesday google calendar http
1309282039334490112,2020-09-25 00:02:18,see you guys tomorrow at mccvrhang out in our awesome magical crypto vr world with bitcoiners litecoiners
1308675686521921537,2020-09-23 07:52:52,rt hang out with your favorite bitcoiners on a tropical islandmccvr the first fullvr bitcoin conferenceexpl
1305230429511770112,2020-09-13 19:42:39,so thats what happened to satoshi he took his bitcoins and went to the future
1298922680985571328,2020-08-27 09:57:54,rt opinion id call ethereum a dumpster fire but a dumpster implies containment thats why its odd that sane and sensible bitc
1296604053997158400,2020-08-21 00:24:30,rt live bitcoin poker game and epic crypto chats follow for our weekly live stream show
1292191132965715968,2020-08-08 20:09:08,rt today marks the third anniversary of the day segwit reached lockin threshold on the bitcoin networktoday also marks the laun
1288995436284452866,2020-07-31 00:30:35,rt live bitcoin poker game and epic crypto chats follow for our weekly live stream show
1281381291464650752,2020-07-10 00:14:41,rt live bitcoin poker game and epic crypto chats follow for our weekly live stream show
1278843718720647168,2020-07-03 00:11:16,rt live bitcoin poker game and epic crypto chats follow for our weekly live stream show
1276307044572647424,2020-06-26 00:11:26,rt live bitcoin poker game and epic crypto chats follow for our weekly live stream show
1273770579393277952,2020-06-19 00:12:26,rt live bitcoin poker game and epic crypto chats follow for our weekly live stream show
1272692558766858241,2020-06-16 00:48:46,we can
1271233624931569664,2020-06-12 00:11:29,rt live bitcoin poker game in collaboration with follow for our weekly live stream show ht
1268696278696775680,2020-06-05 00:08:58,rt live bitcoin poker game follow for weekly live stream games
1263525145563430912,2020-05-21 17:40:44,
1263261875862532097,2020-05-21 00:14:36,rt live bitcoin poker game watch the action and listen to epic crypto chats follow for weekly live stream
1259149254670479366,2020-05-09 15:52:30,
1257825620756590593,2020-05-06 00:12:51,rt announcing episode live bitcoin poker game thursday pm et on twitterbuy in bitcoin blinds kk s
1257503267300335617,2020-05-05 02:51:56,rt the c code in bitcoin core client that will make the bitcoin halving happen constant valuesnsubsidyhalvinginterval
1256937148176990210,2020-05-03 13:22:23,by tiny i just meant small compared to his whole paper wallet balance he lost most of his
1250682051294105600,2020-04-16 07:06:52,rt today im comparing the two currently most popular bitcoin price models rainbow chart vs sfrainbow chart tried amp t
1246766414775480321,2020-04-05 11:47:31,its obviously a scam
1246766332512571393,2020-04-05 11:47:12,its obviously a scam
1238386171962523649,2020-03-13 08:47:26,rt this is the first time in a while ive felt like buying bitcoin that drop was too much panic and too little reason
1233516599920992258,2020-02-28 22:17:29,double spends and orphaned blocks are all counterfeit bitcoins
1232236509173972993,2020-02-25 09:30:52,after seeing your diagram i now know why youre starving
1213360004704563200,2020-01-04 07:22:22,rt lets show the world the power of bitcoin all donations are going to the rural fire service australiaburning
1193739868414730240,2019-11-11 03:58:57,we have talked to major exchanges and they wont be
1190727848979394560,2019-11-02 20:30:16,rt the most important feature of altcoins is competing technologies the best way to improve bitcoin is to let someone else
1186473279638228993,2019-10-22 02:44:08,rt the newest blockchain phone from the exoduss features full bitcoin node capabilities and the highest level of cry
1185904383449427968,2019-10-20 13:03:32,sure you can use rbtc or twitter or hundreds of other online communities
1184510795129872384,2019-10-16 16:45:55,
1183940655120142338,2019-10-15 03:00:23,
1183928358351933440,2019-10-15 02:11:31,thanks
1179271769628303360,2019-10-02 05:47:54,it makes business sense for exchanges to list litecoin as ltc is
1174337665254092800,2019-09-18 15:01:32,its alt szn
1169348079033536512,2019-09-04 20:34:42,its a tweet with a link get over it people can stop following me if they dont like it
1163706883175141383,2019-08-20 06:58:36,i have no proof of this but i think the owner of must have had a romantic relationship with roger ver and
1160491448006877186,2019-08-11 10:01:36,thats a good idea i will talk to thrasher about it
1158490973980151808,2019-08-05 21:32:26,rt this morning someone tried to scam me out of bitcoin on instagram i turned it around on them scammed them out of money
1158432575611760641,2019-08-05 17:40:23,when theres anything ready to be announcement i will announce themthere
1158422778862641152,2019-08-05 17:01:27,thanks
1144794710143315968,2019-06-29 02:28:22,rt craig wright the selfprofessed inventor of bitcoin is testifying today in a west palm beach federal courtroom about
1137070249759584256,2019-06-07 18:54:07,rt my first medium article combining all my tweets about modeling bitcoins value with stocktoflow the halving power
1130234408454070272,2019-05-19 22:10:56,rt we are happy to announce that from today you can send and receive bitcoin amp litecoin on whatsapp via
1127752043710570496,2019-05-13 01:46:54,rt good times at mcc forget ieos byotoilet is the new crypto trend in all seriousness i talked about bitcoins uni
1115276523240452096,2019-04-08 15:33:38,rt just in panterabacked has launched to offer pro traders litecointobitcoin atomic swaps using the lightning net
1111353217047134208,2019-03-28 19:43:49,
1111218853516840961,2019-03-28 10:49:54,lnbcmpwfefwppfhrwayzqrunaky
1108430008291196928,2019-03-20 18:08:02,rt announcing the alpha release of lightning loop a noncustodial service that makes it easier to receive bitcoin on lightnin
1104516055542640640,2019-03-09 22:55:23,rt whats this a completely new sitelitecoin bitcoin flappening
1099930288354844672,2019-02-25 07:13:11,i just lost some brain cells reading that sorry but i dont hav
1099921609295462401,2019-02-25 06:38:41,refer back to the million sided dice make that sided dice
1099919494024114177,2019-02-25 06:30:17,yeah if the number of outputs is finite it can collide chances
1099917741417422848,2019-02-25 06:23:19,hashes are not unique and can collide and miners dont know what
1099916398124355584,2019-02-25 06:17:59,thats like saying you have to account for all the nons youve
1099915756437876736,2019-02-25 06:15:26,no because you also sometimes find blocks sooner than mins so it averages to mins
1099907610260557825,2019-02-25 05:43:04,no thats exactly it hashing is like flipping a coin except it
1098608214839578625,2019-02-21 15:39:44,im so into crypto that im even blocked by
1092710359109054464,2019-02-05 09:03:45,rt exclusive google adds support for bitcoin ethereum litecoin zcash dash bitcoin cash ethereum classic and dogecoin ht
1089968301827022848,2019-01-28 19:27:48,rt its all about adoption so excited about the litecoin foundations bitcoin litecoin amp lightning network builders track
1083404867815624704,2019-01-10 16:47:03,rt running bitcoin
1081995190296965120,2019-01-06 19:25:30,
1081992710037225473,2019-01-06 19:15:39,
1081988880474112000,2019-01-06 19:00:26,please add support to send ltc to maddresses addr
1081429776986923008,2019-01-05 05:58:45,rt ltcd is now up to date with btcd this includes neutrino support for lnd so to and
1076758430688239617,2018-12-23 08:36:29,rt lightning wallet adds litecoin support ltc litecoin btc bitcoin crypto cryptocurrency h
1075788713282625537,2018-12-20 16:23:11,rt expands its mining pool operation by adding support for litecoin mining mine ltc for free n
1069635596157513728,2018-12-03 16:52:53,rt litecoins new king whalebn transacted on the litecoin network in a single dayltc litecoin btc bitcoin cr
1058040278336995328,2018-11-01 16:57:14,rt price is actually the most interesting thing about bitcoin
1054777373063700480,2018-10-23 16:51:37,rt the reason dark markets and silkroad used bitcoin in the first place is because bitcoin is good money says
1048643713948213248,2018-10-06 18:38:38,rt stop the bullying bitcoin bitcoincash litecoin lightningnetwork crypto cryptocurrency altco
1047965458815639552,2018-10-04 21:43:30,rt crypto exchange erisx will provide spot and physical futures exchange for bitcoin bitcoincash litecoin and ethereum
1041906546752466944,2018-09-18 04:27:33,finally a bit about hodling the term came from a bitcointalk forum user who refused to sell when the market is
1041247913249103873,2018-09-16 08:50:22,hodl was coined by a person on bitcointalk that refused to sell when the market
1040623306389385217,2018-09-14 15:28:24,rt weve implemented litecoin in libbitcoin libbitcoin gives the litecoin community a high performance blockchain query
1024878400916209664,2018-08-02 04:43:46,rt silver to bitcoins goldplease enjoy our newest research paper on litecoin one of the worlds most well established
1020642862558572544,2018-07-21 12:13:15,
1020639284771115008,2018-07-21 11:59:02,im the guy sitting between and
1020146947397566464,2018-07-20 03:22:40,i bought bitcoin
1019989851842609152,2018-07-19 16:58:25,
1019913185829138432,2018-07-19 11:53:47,now thats pushing it
1019911852149465088,2018-07-19 11:48:29,haha you and me both i also run an a at a loss
1019812152234786816,2018-07-19 05:12:18,im still spending full time working on litecoin and i didnt call litecoin a shitcoin what are you
1019742811371945984,2018-07-19 00:36:46,dogecoin already tested that security and hashrate went down fas
1019139540215185409,2018-07-17 08:39:35,there will be at most million bitcoins in existence there isnt even enough btc to go around for every milliona
1018858434429530113,2018-07-16 14:02:34,ripple created billions of dollars out of thin air and can afford to throw money at banks for partnershi
1018858094401474561,2018-07-16 14:01:13,illegal
1017809957415051265,2018-07-13 16:36:18,because i saw people talking about it
1017778062451191808,2018-07-13 14:29:34,fakenews not funny some people will actually believe you sadly
1017373700411314176,2018-07-12 11:42:46,your memory really failed you like i said pr
1017362351710982144,2018-07-12 10:57:40,never happened proof or gtfo stop making shit up
1017361708287963136,2018-07-12 10:55:07,what about them what are you trying to say
1017093181739945985,2018-07-11 17:08:05,youre exaggerating i said im not focused on price and investing i was never berating any investors
1016509240209498117,2018-07-10 02:27:43,a fraud just blocked you haha
1016407459131355136,2018-07-09 19:43:16,read the article btcc does not run any mining rigs so we are not a bitcoin mining op
1016380015624126467,2018-07-09 17:54:13,dare i say most technical bitcoiners dont agree with satoshis assessment from years ago
1013643921174351872,2018-07-02 04:41:58,hey cz list decred now please thanks
1011264936532586496,2018-06-25 15:08:43,nope
