id,created_at,text
1110673196158717952,2019-03-26 22:41:39,rt givet
993820446553509888,2018-05-08 11:50:33,rt dear there is an easy way to short bitcoin you can short xbt the bitcoin usd futures contract a
901453834324672513,2017-08-26 14:38:36,will electricity eventually only be sold for bitcoin well know this is happening when miners start buying electric companies
900463551881654273,2017-08-23 21:03:35,love hearing bitcoin stories like this
898557412466184192,2017-08-18 14:49:16,the scale that bitcoin mining has reached is impressive
877845355886465024,2017-06-22 11:06:57,bitcoin
873400974941073408,2017-06-10 04:46:34,rt bitpay investor ashton kutcher dropped by our office this week to talk to our team amp share insights on taking bitcoin payments
865030104027717632,2017-05-18 02:23:42,heres an idea bitcoin holidays to let the transaction backlog clear
864885970730188807,2017-05-17 16:50:58,rt staff at all get paid in bitcoin with fees skyrocketing we may have to switch to or
864885675925098501,2017-05-17 16:49:48,best plan mb hard fork on bitcoin now test segwit on litecoin
864803133482049536,2017-05-17 11:21:48,great visual bitcoin fees will continue to rise indefinitely until enough people stop using it
864798401912856576,2017-05-17 11:03:00,a typical bitcoin transaction costs now gtk unconfirmed transactions time for a hard fork to larger blocks mb please
864633849447424000,2017-05-17 00:09:08,its good to test segwit on litecoin for a while before it is deployed in bitcoin
864543696552955905,2017-05-16 18:10:54,i could support the simplest hf to mb soft limit mb hard limit for bitcoin wquadratic hashing protection
864523737055580160,2017-05-16 16:51:35,the truth about scaling bitcoin very well written and spot on
862989385540800514,2017-05-12 11:14:37,good article on how bitcoin is crowd funding capital flow
860456206321823744,2017-05-05 11:28:40,this is a nice overview of the bitcoin extension block proposal
857014345947111424,2017-04-25 23:31:57,use bitcoin
856549746709843968,2017-04-24 16:45:48,the testnet for bitcoin extension blocks went live this weekend plans to test
854144085900308480,2017-04-18 01:26:33,awesome video on accepting bitcoin with checkout app
849228784184299521,2017-04-04 11:54:54,here is another good article on the bitcoin extension block proposal by
849226785350975488,2017-04-04 11:46:58,excited about this bitcoin proposal from the team and good article
847054373461147650,2017-03-29 11:54:34,in the future the vast majority of bitcoin transactions will be offchain
847052704685965313,2017-03-29 11:47:56,indeed i think just about nothing short of a failure in ecdsa will stop bitcoin
844968748981334018,2017-03-23 17:47:03,rt just launched a bitpay bitcoin payment option in their toronto office cafe
844566535431733250,2017-03-22 15:08:47,the copay bitcoin wallet gets a major performance boost today new version of app too
843939263838347265,2017-03-20 21:36:14,great article on team member liya in amsterdam bitcoin
842471827704299520,2017-03-16 20:25:10,here are some of my thoughts on a safer way to upgrade bitcoin
842180758869557248,2017-03-16 01:08:34,great article on transaction growth and bitcoin
839209088907161600,2017-03-07 20:20:13,thoughts on rapidly rising bitcoin miner fees and what they mean for and the bitcoin network
837170965184401408,2017-03-02 05:21:26,rt i changed my mind rbitcoin is also a cesspool its a bubashing corepraising censored echo chamber rbtc is much b
837170919831392257,2017-03-02 05:21:15,rt sadly rbtc is becoming a cesspool its basically a coreblockstreamsegwitbashing bupraising echo chamber rbitco
836708482086764545,2017-02-28 22:43:42,bitcoin transaction fees under seem like a bargain now
836251740286648320,2017-02-27 16:28:46,rt bitpays and speak today at distmarkets on bitcoin payments amp smart contracts
831162193806761984,2017-02-13 15:24:43,really nice overview of the bitcoin app
822252508492005376,2017-01-20 01:20:49,rt new to paying with bitcoin check out our short guide to getting started
821112139935088640,2017-01-16 21:49:24,rt weve been nominated for the fintech awards you can vote for bitcoin payments here df
811953871492907009,2016-12-22 15:17:42,bitpay secure bitcoin wallet manage your bitcoin finances in one app on
807583013441830913,2016-12-10 13:49:29,a bitcoin segment on stossel talking about venezuela
806481760565547008,2016-12-07 12:53:30,if you are looking for a good bitcoin wallet consider using the bitpay app
802506392422776832,2016-11-26 13:36:48,its great to see eampy using copay for their bitcoin wallet
798709653056192512,2016-11-16 02:09:55,this is an amazingly good description of bitcoin
796707121584803840,2016-11-10 13:32:34,we just launched the bitpay app a new way to store spend and secure bitcoin check it out
791391415305695232,2016-10-26 21:29:51,rt found in a random atlanta gas station a genuine bitcoin atm
791321688008974336,2016-10-26 16:52:47,great article about our new bitcoin app
790232044966072320,2016-10-23 16:42:55,bitcoin atm at the d hotel in las vegas is a popular spot bitcoin
773971801894449156,2016-09-08 19:50:31,rt everybody is excited about altcoins but nobody is using them bitcoin blockchain
768978119919296512,2016-08-26 01:07:25,this is an exciting new development in bitcoin mining
768082826126299136,2016-08-23 13:49:50,very cool to see bitcoin companies starting to turn years old
761529544188780544,2016-08-05 11:49:26,beware of fake wallet apps on ios that steal bitcoin how could these possibly get through apple review
757908557949984769,2016-07-26 12:00:56,the bitcoin core developers deserve a lot of credit for sticking to their guns on the block size issue
757906848267825153,2016-07-26 11:54:08,in this bitcoin crypto currency gold rush i see fools gold everywhere
752545947301867524,2016-07-11 16:51:50,seafile is now accepting bitcoin
750767500850266113,2016-07-06 19:04:55,heres an excellent tutorial on programming bitcoin in javascript with the bitcore library
750320535863689216,2016-07-05 13:28:50,this bitcoin enthusiast created a great getting started video tutorial for copay
748307704561700864,2016-06-30 00:10:34,rt our new visa worked like a charm when we needed new printer ink love buying office supplies with bitcoin
746839081632444416,2016-06-25 22:54:47,for bitcoin marketing it would be good to start with renaming to
745624937843523584,2016-06-22 14:30:12,good analysis by of the annual fsoc report as it relates to bitcoin
743859966977662976,2016-06-17 17:36:51,glad to see cpfp child pays for parent finally implemented in bitcoin
743789230510510080,2016-06-17 12:55:46,really excited to see people finding the card useful bitcoin
732610982531452928,2016-05-17 16:37:24,rt you can use bitcoin to buy a bitcoinpizzaday slice for kids at order here
732594606936842240,2016-05-17 15:32:19,rt you can now buy a slice of papa johns pizza via bitcoin for the children amp families of the ht
731118251401445377,2016-05-13 13:45:49,the game theory here is interesting its not clear the a patent on bitcoin mining hardware has any value
731115008852103169,2016-05-13 13:32:56,nice demo of a payment from a customer to a merchant using bitcoin
727605096813608960,2016-05-03 21:05:47,we just launched the the first uswide visa debit card you can load using bitcoin check out the card
725822960628584448,2016-04-28 23:04:13,here is a great example of the unique requirements of bitcoin inspiring innovation in the software field
725744286478692354,2016-04-28 17:51:36,rt want to try out s new bitcoin payment option heres what you need to know
720789498225946628,2016-04-15 01:43:02,great video that shows just how easy it can be to accept bitcoin
719956151190888449,2016-04-12 18:31:37,good article about bitcoin on seeking alpha
713038845508452354,2016-03-24 16:24:43,rt play the lottery on your smartphone using bitcoin meet our new merchant
712326124056006656,2016-03-22 17:12:37,analysis code and bip on the bitcoin adaptive block size
710705416712417280,2016-03-18 05:52:30,i dont see why this is so much an attack on bitcoin as it is a defense of the bolivar
710680046218838016,2016-03-18 04:11:41,venezuela govt defends its currency bitcoin
710501250463174656,2016-03-17 16:21:13,great article on bitcoin in latin america
706934919403065344,2016-03-07 20:09:53,what i learned at the bitcoin
705542823358160896,2016-03-03 23:58:12,bb billing is an important often overlooked service that offersweve recently enhanced it bitcoin
705383295459131392,2016-03-03 13:24:17,very happy with how well copay has handled bitcoin network congestion its dynamic fees seem to be working well
705240167783768064,2016-03-03 03:55:33,it seems to me that bitcoin is learning how to upgrade itselfits wild success is a forcing function
704677770077540353,2016-03-01 14:40:47,yesterday bitcoin set a new all time high number of transactions on the network thats very exciting to see
701855493019541504,2016-02-22 19:46:04,oped by nasdaq on the implications of the apple court order on bitcoin
701793260046565377,2016-02-22 15:38:46,a pretty good analysis of bitcoin by ito
698856292123865088,2016-02-14 13:08:18,silly argument bitcoin is the longest chain and bitcoin was a hard fork albeit accidental
697957291291709440,2016-02-12 01:36:00,bitcoin miners are asking the bitcoin core project to provide a plan for a mb hard fork upgrade to bitcoin
697114164154785793,2016-02-09 17:45:43,read about bitpays support for optin rbf for bitcoin here
690702916517269504,2016-01-23 01:09:42,jamie dimon does a on bitcoin
689092913733722114,2016-01-18 14:32:08,very good advice from for the bitcoin community
687980581041344512,2016-01-15 12:52:07,if i only had a bitcoin for every time someone declared it to be dead
685109164503396352,2016-01-07 14:42:08,read our current thoughts on the bitcoin block size limit here
684741637390643200,2016-01-06 14:21:42,ive posted an article on bitcoin scalability hard forks and fee markets
684425906098712576,2016-01-05 17:27:06,rt our bitcore team joins s in min to discuss our opensource platform for bitcoin development
684425548878233600,2016-01-05 17:25:41,catch bitcoreio live on floss weekly today bitcoin
684424289974644736,2016-01-05 17:20:41,excited to have bitcoreio nodes running on microsoft azure bitcoin
684384680909606912,2016-01-05 14:43:17,ive posted a few thoughts on bitcoin as a settlement system
684360308324958208,2016-01-05 13:06:26,gavin is saying the same thing miners control the bitcoin rules but miners cant force people to use it
684358695556374530,2016-01-05 13:00:02,miners control bitcoin in the same way apple controls the iphoneof course as i stated users can vote with their feet
684030408099495936,2016-01-04 15:15:32,posted an article about the role miners play in controlling bitcoin
682929628885954562,2016-01-01 14:21:26,rt hmmbloomberg named bitcoin worst performing currency in but excludes in when it was best cc http
681916062045224961,2015-12-29 19:13:53,good article discussion the bitcoin block size limit
681211347628077057,2015-12-27 20:33:36,yep bitcoin users can simply run bu and let miners figure out for themselves how to coordinate on a limit
676975990782959621,2015-12-16 04:03:48,the best bitcoin wallet is even better copay is primarily a ui enhancement releaseaddress book is great too
676209488706199552,2015-12-14 01:18:00,if history is any guide bitcoin will not likely become a settlement system unless it first has widespread adoption as a payment system
676192197377589248,2015-12-14 00:09:17,good article if youre considering bitcoin as an investment
672157166682288128,2015-12-02 20:55:31,rt canadian bitcoin users all provinces but quebec can now sign up for via copay to buysell btc inapp
670585207414722560,2015-11-28 12:49:06,update from these guys may single handedly change the economics of the internet bitcoin
666768284403019777,2015-11-18 00:02:01,rt copay users in supported areas can now sign up for to buysell bitcoin inapp no beta invites needed
664426428058857472,2015-11-11 12:56:19,i see a parade of articles suggesting bitcoin is not usable or being used as a currency and yet the facts on the ground suggest otherwise
661669306200035328,2015-11-03 22:20:30,sending money to china right now bitcoin is the best way to do it you will get paid ask moneygram for a price match
659370558144933888,2015-10-28 14:06:06,rt evaluating s bitcore very cool bitcoin buidl
657211712462913537,2015-10-22 15:07:37,bitcore full node block explorer wallet server and payment acceptance built on bitcoind bitcoin
656646145695981569,2015-10-21 01:40:15,the latest release of copay adds support for buying and selling bitcoin among other things
646708145901993985,2015-09-23 15:30:11,we released a new version of copay today bitcoin
646304081896734720,2015-09-22 12:44:35,exciting in a couple years may have what every chip manufacturer is going to need bitcoin iot
646137892016885761,2015-09-22 01:44:12,im excited to see make a public announcement about their service bitcoin bitcore copay
645601190646935552,2015-09-20 14:11:33,bigo and bitcoin
643213520130150401,2015-09-14 00:03:48,the scalingbitcoin conference was one of the better bitcoin conferences ive been to optimistic about blocksize issue
641335834952749056,2015-09-08 19:42:33,weve enhanced multiuser support for merchants accepting bitcoin
640482137544617984,2015-09-06 11:10:15,colu talks about colored coins support theyve built for copay bitcoin
634460940524781572,2015-08-20 20:24:10,copay should be ready for the next bitcoin stress test
634174754879078400,2015-08-20 01:26:58,we support the adoption of bip for increasing bitcoins blocksize limit
633696477274095616,2015-08-18 17:46:28,see our video of new bitcoin merchant features we just released and the blog post
633664537758179328,2015-08-18 15:39:33,merchants now have some excellent new tools to handle bitcoin payment exceptions
619531828769226752,2015-07-10 15:41:12,the best bitcoin wallet just got a little better
618197298279923712,2015-07-06 23:18:16,the tourism and export industries in greece should start using bitcoin immediately greekcrisis
615967217528774656,2015-06-30 19:36:43,the tourism industry in greece should experiment with accepting bitcoin it would be a great way to earn bitcoin from foreign visitors
613527994884190209,2015-06-24 02:04:07,great quote everybody who does not own a payments rail is going to coordinate around bitcoin
609058962961510400,2015-06-11 18:05:47,last week we launched copay our open source bitcoin wallet out of beta ask me anything
608073439295893505,2015-06-09 00:49:40,part of the beauty of bitcoin is that users will ultimately make the decision on important matters like block size not developers
606208002299805696,2015-06-03 21:17:05,we released the copay bitcoin walleti really love this wallet and think many others will too
603248123520163840,2015-05-26 17:15:35,gavin on block size analysis bitcoin
601101999292178432,2015-05-20 19:07:39,rt our ceo amp are live on discussing our copay bitcoin wallet watch
600829360237600768,2015-05-20 01:04:17,chaindb doesnt have miners it has bidders bitcoin miners can create chaindb blocks if its a public chain
600827633887248385,2015-05-20 00:57:25,correct though some chains might need even less frequencybut definitely no more than one per bitcoin block
600827462721867776,2015-05-20 00:56:44,actually reorgs of the bitcoin chain are expected and cause corresponding chaindb reorgs
600694035876093953,2015-05-19 16:06:33,weve published a paper on chaindbs consensus mechanism and are seeking feedback bitcoin
595588210564075520,2015-05-05 13:57:49,gavins proposal to increase the bitcoin block size would happen in march thats a much longer comment period than bitlicense
593196684391411712,2015-04-28 23:34:45,called about gbtc they said that they havent enabled trading because bitcoin is too risky gee thx
581631352044322816,2015-03-28 01:38:15,bitcoin can also fix vulnerable systems digital currencies applied mathematics
577507150441750528,2015-03-16 16:30:08,good crowd at the audience had a lot of people new to bitcoin
577261272665845760,2015-03-16 00:13:07,got a a thumbs up from a couple on a bike in atlmust have seen the the bitpay platejust the pick me up i neededthank you bitcoin
575805541726863361,2015-03-11 23:48:33,rt artforz figured out months before anyone else how to leverage the capability of gpus for bitcoin mining
564832573512511489,2015-02-09 17:05:54,unfortunately i think this article is correct bitcoin
555588810298642433,2015-01-15 04:54:29,people say bitcoin will be very stable once a lot of people use it i sometimes think that too then i look at the price of oil
552642648943910913,2015-01-07 01:47:29,the block chain has been nominated for the best technology achievement crunchie go vote bitcoin
541591905856139264,2014-12-07 13:55:47,flaws in ripple aside ripple is missing the most important feature of bitcoin zero trust history
537779553041915905,2014-11-27 01:26:51,in early we began recording human history in an unalterable digital form bitcoin
528363817797812224,2014-11-01 01:52:05,we just had one of the highest transaction volume days in bitcoin
505716755969216512,2014-08-30 14:00:45,great article on bitcoin price and merchant adoption it increases the value of bitcoin duh
499685143032786945,2014-08-13 22:33:16,we made a video to help explain how we help businesses use bitcoin bitcoin
498478128550146048,2014-08-10 14:37:01,bitcoreio discussed on floss weekly bitcoin bitcore
497029089132175360,2014-08-06 14:39:03,its easier than ever for merchants to accept bitcoin bitcoin
492420010451558401,2014-07-24 21:24:14,get paid in bitcoin with zuman
486878414662430721,2014-07-09 14:23:54,bitpay announces an open source multisig wallet
485406899370602496,2014-07-05 12:56:37,this is not an uncommon story and im sure well here a lot more like it bitcoin
484686653131616256,2014-07-03 13:14:37,cant wait until you can get a shave and a haircut for bits bitcoin
483942383453626369,2014-07-01 11:57:10,bitpay launched years ago today and today newegg begins accepting bitcoin
478603602382966784,2014-06-16 18:22:45,bitcoin talks about bitcore bitcoin bitpay bitcore
478210340548009986,2014-06-15 16:20:04,beware there re reports of an email to download your bitpay wallet this is phishing attempt bitpay bitcoin
469165007734050816,2014-05-21 17:17:09,euro pacific metals now accepts bitcoin with bitpay
466956370986541057,2014-05-15 15:00:49,how about have they blocked it
